{
  "$schema": "../Schemas/coverage-policy.schema.json",
  "schemaVersion": 1,
  "documentID": "AH-COVERAGE-BASELINE-V1",
  "documentType": "baseline",
  "baselineCapturedAtCommit": "c65b4b973a9cc8833dcd933771785a7da28c7b15",
  "baselineStatus": "established",
  "releaseGate": "open",
  "entries": [
    { "scope": "AgentContracts", "status": "measured", "linePercent": 93.50737413120868, "functionPercent": 95.67164179104478, "reason": "Formal SwiftPM/LLVM evidence from the first committed AgentContracts implementation." },
    { "scope": "AgentRuntime", "status": "measured", "linePercent": 98.07807807807808, "functionPercent": 100, "reason": "Formal SwiftPM/LLVM evidence from the first committed AgentRuntime implementation and coverage-closure checkpoint." },
    { "scope": "AgentSandboxAPI", "status": "measured", "linePercent": 98.9938080495356, "functionPercent": 100, "reason": "Formal SwiftPM/LLVM evidence from the first committed AgentSandboxAPI implementation." },
    { "scope": "changed-agent-harness-lines-and-adapters", "status": "measured", "linePercent": 91.54929577464789, "functionPercent": 100, "reason": "Formal changed-source evidence for the AgentRuntime coverage-closure checkpoint." }
  ]
}
